{
  "feature_registry_version": "1.0.0",
  "features": [
    {
      "name": "return_1d",
      "params": {}
    },
    {
      "name": "return_5d",
      "params": {}
    },
    {
      "name": "return_10d",
      "params": {}
    },
    {
      "name": "return_20d",
      "params": {}
    },
    {
      "name": "sma_5",
      "params": {}
    },
    {
      "name": "sma_10",
      "params": {}
    },
    {
      "name": "sma_20",
      "params": {}
    },
    {
      "name": "sma_50",
      "params": {}
    },
    {
      "name": "sma_200",
      "params": {}
    },
    {
      "name": "price_sma5_ratio",
      "params": {}
    },
    {
      "name": "price_sma20_ratio",
      "params": {}
    },
    {
      "name": "price_sma50_ratio",
      "params": {}
    },
    {
      "name": "price_sma200_ratio",
      "params": {}
    },
    {
      "name": "sma5_sma20_ratio",
      "params": {}
    },
    {
      "name": "sma20_sma50_ratio",
      "params": {}
    },
    {
      "name": "sma50_sma200_ratio",
      "params": {}
    },
    {
      "name": "ema_12",
      "params": {}
    },
    {
      "name": "ema_26",
      "params": {}
    },
    {
      "name": "momentum_5",
      "params": {}
    },
    {
      "name": "momentum_10",
      "params": {}
    },
    {
      "name": "momentum_20",
      "params": {}
    },
    {
      "name": "roc_5",
      "params": {}
    },
    {
      "name": "roc_10",
      "params": {}
    },
    {
      "name": "roc_20",
      "params": {}
    },
    {
      "name": "high_low_range",
      "params": {}
    },
    {
      "name": "close_position",
      "params": {}
    },
    {
      "name": "hvol_5",
      "params": {}
    },
    {
      "name": "hvol_10",
      "params": {}
    },
    {
      "name": "hvol_20",
      "params": {}
    },
    {
      "name": "hvol_50",
      "params": {}
    },
    {
      "name": "hvol_ratio_5_20",
      "params": {}
    },
    {
      "name": "hvol_ratio_10_50",
      "params": {}
    },
    {
      "name": "atr_14",
      "params": {}
    },
    {
      "name": "atr_percent",
      "params": {}
    },
    {
      "name": "bb_middle",
      "params": {}
    },
    {
      "name": "bb_upper",
      "params": {}
    },
    {
      "name": "bb_lower",
      "params": {}
    },
    {
      "name": "bb_width",
      "params": {}
    },
    {
      "name": "bb_position",
      "params": {}
    },
    {
      "name": "kc_width",
      "params": {}
    },
    {
      "name": "vol_sma_5",
      "params": {}
    },
    {
      "name": "vol_sma_20",
      "params": {}
    },
    {
      "name": "vol_sma_50",
      "params": {}
    },
    {
      "name": "vol_ratio_5",
      "params": {}
    },
    {
      "name": "vol_ratio_20",
      "params": {}
    },
    {
      "name": "obv",
      "params": {}
    },
    {
      "name": "obv_sma_20",
      "params": {}
    },
    {
      "name": "obv_trend",
      "params": {}
    },
    {
      "name": "vwap_20",
      "params": {}
    },
    {
      "name": "price_vwap_ratio",
      "params": {}
    },
    {
      "name": "ad_line",
      "params": {}
    },
    {
      "name": "rsi_14",
      "params": {}
    },
    {
      "name": "rsi_oversold",
      "params": {}
    },
    {
      "name": "rsi_overbought",
      "params": {}
    },
    {
      "name": "macd",
      "params": {}
    },
    {
      "name": "macd_signal",
      "params": {}
    },
    {
      "name": "macd_hist",
      "params": {}
    },
    {
      "name": "macd_cross_up",
      "params": {}
    },
    {
      "name": "stoch_k",
      "params": {}
    },
    {
      "name": "stoch_d",
      "params": {}
    },
    {
      "name": "williams_r",
      "params": {}
    },
    {
      "name": "cci",
      "params": {}
    },
    {
      "name": "adx",
      "params": {}
    },
    {
      "name": "plus_di",
      "params": {}
    },
    {
      "name": "minus_di",
      "params": {}
    },
    {
      "name": "trend_strength",
      "params": {}
    },
    {
      "name": "trend_direction",
      "params": {}
    },
    {
      "name": "day_of_week",
      "params": {}
    },
    {
      "name": "day_of_month",
      "params": {}
    },
    {
      "name": "month",
      "params": {}
    },
    {
      "name": "quarter",
      "params": {}
    },
    {
      "name": "week_of_year",
      "params": {}
    },
    {
      "name": "is_month_end",
      "params": {}
    },
    {
      "name": "is_month_start",
      "params": {}
    },
    {
      "name": "days_into_year",
      "params": {}
    }
  ],
  "missingness_per_feature": {},
  "normalization_method": "standard_scaler",
  "leakage_checks_status": "passed"
}